id,name,field,old,new
usr_bf4ae5cffe25474bbdbe,Chirag Paswan - Accompany,designation,with CG Chirag Paswan,Accompanying guest of Chirag Paswan
usr_a13a3eef40c14665b4fd,Jishnu Dev Varma - Accompany,designation,with CG Jishnu Dev Varma,Accompanying guest of Jishnu Dev Varma
usr_f866ec94f9444f3d90a1,Ram Nath Kovind - Accompany,designation,with CG Ram Nath Kovind,Accompanying guest of Ram Nath Kovind
usr_5a2304ea28dc4fe9b7db,Ram Nath Kovind - Accompany #2,designation,with CG Ram Nath Kovind,Accompanying guest of Ram Nath Kovind
usr_d2b70dba45ca474d8a32,Sandra Boodhun,designation,Special Advisor to the President of the Central African Republic,Special Adviser to the President of the Central African Republic
usr_716583bd67d24acdbc21,Kailash Satyarthi,bio,"Shri Kailash Satyarthi — born Kailash Sharma on 11 January 1954 in Vidisha, Madhya Pradesh — is India's first natural-born Nobel Peace Laureate, sharing the 2014 prize with Malala Yousafzai. An engineer who walked away from the drawing board to walk into bonded-labour quarries, he founded Bachpan Bachao Andolan (1980), GoodWeave (1994), the Global March Against Child Labour (1998) and, most recently, the Satyarthi Movement for Global Compassion (2024). More than 138,000 children stand freed in his wake. He speaks softly, marches long, and calls compassion the oxygen of humanity.","An engineer who walked away from the drawing board to walk into bonded-labour quarries, he founded Bachpan Bachao Andolan (1980), GoodWeave (1994), the Global March Against Child Labour (1998) and, most recently, the Satyarthi Movement for Global Compassion (2024). More than 138,000 children stand freed in his wake. He speaks softly, marches long, and calls compassion the oxygen of humanity"
usr_716583bd67d24acdbc21,Kailash Satyarthi,honours,"Nobel Peace Prize 2014 (shared with Malala Yousafzai) — first natural-born Indian Nobel Peace Laureate; Robert F. Kennedy Human Rights Award (1995); Friedrich Ebert Stiftung Human Rights Award (1999); Wallenberg Medal, University of Michigan (2002); US State Department ""Heroes Acting to End Modern Day Slavery"" (2007); Gold Medal of the Italian Senate (2007); Alfonso Comín International Award (2008); Defenders of Democracy Award (2009); Wockhardt Foundation Lifetime Achievement Award (2019); Mother Teresa Memorial Award (2019); Harvard Humanitarian of the Year (2015)","Kennedy Human Rights Award (1995); Friedrich Ebert Stiftung Human Rights Award (1999); Wallenberg Medal, University of Michigan (2002); US State Department ""Heroes Acting to End Modern Day Slavery"" (2007); Gold Medal of the Italian Senate (2007); Alfonso Comín International Award (2008); Defenders of Democracy Award (2009); Wockhardt Foundation Lifetime Achievement Award (2019); Mother Teresa Memorial Award (2019); Harvard Humanitarian of the Year (2015)"
usr_716583bd67d24acdbc21,Kailash Satyarthi,qualifications,"B.E. (Electrical Engineering), SATI Vidisha / University of Bhopal; M.E. (High- Voltage Engineering); PG Diploma (Transformer Design); multiple honorary doctorates (Alliance University 2014, Amity 2015/2018, Lynchburg College 2016 DHL, WBNUJS 2016 LLD, Universidad Pablo de Olavide Spain 2017, Amrita University 2022)","B. E. (Electrical Engineering), SATI Vidisha / University of Bhopal; M. E. (High- Voltage Engineering); PG Diploma (Transformer Design); multiple honorary doctorates (Alliance University 2014, Amity 2015/2018, Lynchburg College 2016 DHL, WBNUJS 2016 LLD, Universidad Pablo de Olavide Spain 2017, Amrita University 2022)"
usr_8c6afb30f49a499db723,Mohan Munasinghe,designation,"Founder Chairman, Munasinghe Institute for Development (MIND) and the MIND Group, Colombo, Sri Lanka. Concurrent roles: Chairman, Climate and Conservation Consortium (CCC); Distinguished Guest Professor, Peking University; Honorary Senior Advisor to the Government of Sri Lanka; former Chairman, Presidential Expert Commission on Sustainable Sri Lanka 2030 Vision","Founder Chairman, Munasinghe Institute for Development (MIND) and the MIND Group, Colombo, Sri Lanka. Concurrent roles: Chairman, Climate and Conservation Consortium (CCC); Distinguished Guest Professor, Peking University; Honorary Senior Adviser to the Government of Sri Lanka; former Chairman, Presidential Expert Commission on Sustainable Sri Lanka 2030 Vision"
usr_8c6afb30f49a499db723,Mohan Munasinghe,bio,"Born in Colombo in July 1945 to an engineer-father and a literary mother, Professor Mohan Munasinghe climbed Cambridge, MIT, McGill and Concordia before returning to counsel presidents and the World Bank. As Vice-Chair of the IPCC's Fourth Assessment, he shared the 2007 Nobel Peace Prize with the IPCC and Al Gore; the 2021 Blue Planet Prize followed for his Sustainomics framework. Officer of the Legion of Honour, Deshamanya of Sri Lanka, founder of the MIND institute in Colombo, he champions peace as inseparable from sustainable development — convening climate, equity and dignity under one patient sky.","Born in Colombo in July 1945 to an engineer-father and a literary mother, Professor Mohan Munasinghe climbed Cambridge, MIT, McGill and Concordia before returning to counsel presidents and the World Bank. As Vice-Chair of the IPCC's Fourth Assessment, he shared the 2007 Nobel Peace Prize with the IPCC and Al Gore; the 2021 Blue Planet Prize followed for his Sustainomics framework. Officer of the Legion of Honour, Deshamanya of Sri Lanka, founder of the MIND institute in Colombo, he champions peace as inseparable from sustainable development — convening climate, equity and dignity under one patient sky"
usr_8c6afb30f49a499db723,Mohan Munasinghe,honours,"Independently confirmed: 2007 Nobel Peace Prize — shared as Vice-Chair of the IPCC. The prize was awarded jointly to the Intergovernmental Panel on Climate Change (IPCC) and Albert Arnold (Al) Gore Jr.; Professor Munasinghe's laureateship derives from his service as Vice-Chair of the IPCC during the Fourth Assessment Report (AR4) cycle (Nobel committee records). 2021 Blue Planet Prize Laureate (Asahi Glass Foundation). Officer of the French Legion of Honour (2017). Deshamanya — highest Sri Lankan national civil honour. Anita Garibaldi Gold Medal (Brazilian government, 2007). Zayed International Prize for Environment (2006, joint, for the Millennium Ecosystem Assessment). Eminence in Engineering Award, Institute of Engineers Sri Lanka (2014). Adelman-Frankel Prize, USAEE (2003). Sinha Gold Medal, Lions Clubs International Sri Lanka (1985). Sarvodaya Award for Humanity, Peace and Development (2007). Medal of Honour for Exceptional Contributions to Sustainability and Peace — World Peace and Diplomacy organisation. Not independently verified: a Padma Shri has been referenced in earlier internal notes but a direct search of padmaawards.gov.in did not return a matching record; his own Wikipedia entry does not list it. PADMA SHRI STATUS UNVERIFIED pending direct confirmation from the Ministry of Home Affairs dashboard or a PIB gazette notification; should NOT be published without it. ""Vishwa Prasadini"" also not explicitly documented in reviewed biographies and likewise unverified. Deshamanya is firmly confirmed. Organisational footprint: Founder Chairman, Munasinghe Institute for Development (MIND) — private non-profit think tank, Colombo; Chairman, MIND Group; Chairman, Climate and Conservation Consortium (CCC); Director, Eureka Group; Advisor, Planetiers. Former: Board Member, Green Cross International; Member, The Club of Rome; Director-General, Sustainable Consumption Institute, University of Manchester; Chancellor, International Water Academy, Oslo; Vice-Chair, IPCC during AR4; Senior Manager / Advisor, World Bank (until 2002)","2007 Nobel Peace Prize contributor through his service as Vice-Chair of the Intergovernmental Panel on Climate Change during the Fourth Assessment Report cycle; 2021 Blue Planet Prize Laureate; Officer of the French Legion of Honour (2017); Deshamanya, Sri Lanka."
usr_8c6afb30f49a499db723,Mohan Munasinghe,qualifications,"Correction to earlier register brief — PhD is from McGill, NOT MIT: B.A. (Hons.) Engineering, University of Cambridge (1967); M.A. Cambridge (conferred subsequently); S.M. and Professional Engineer (PE), Electrical Engineering, Massachusetts Institute of Technology (MIT), 1970; PhD in Solid State Physics, McGill University, Montreal (1973); M.A. in Development Economics, Concordia University, Canada (1975); multiple honorary doctorates (honoris causa), including Independent University of Bangladesh (2005)","B.A. (Hons.) Engineering, University of Cambridge; S.M. and Professional Engineer (PE), Electrical Engineering, Massachusetts Institute of Technology; PhD in Solid State Physics, McGill University; M.A. in Development Economics, Concordia University."
usr_5f35fdb55e4d4d6cbcca,Ramdas Athawale,designation,"Union Minister of State for Social Justice and Empowerment, Government of India, Narendra Modi 3.0 Cabinet (continuing since June 2024). Concurrently Member of Parliament (Rajya Sabha), Maharashtra; Founder-President, Republican Party of India (Athawale) — RPI(A), since 1999","Union Minister of State for Social Justice and Empowerment, Government of India, Narendra Modi 3. 0 Cabinet (continuing since June 2024). Concurrently Member of Parliament (Rajya Sabha), Maharashtra; Founder-President, Republican Party of India (Athawale) — RPI(A), since 1999"
usr_5f35fdb55e4d4d6cbcca,Ramdas Athawale,bio,"Hon'ble Shri Ramdas Bandu Athawale — born 25 December 1959 in Agalgaon, Sangli — is Dalit Maharashtra's most visible political couplet-maker. Founder-President of the Republican Party of India (Athawale) since 1999, Rajya Sabha MP since 2014 (re-elected unopposed 2020), and continuously Union Minister of State for Social Justice and Empowerment since 2016 through Modi 3.0, he is Marathi poet, Ambedkarite, Buddhist and film actor rolled into one. His rhyming Hindi verses (""Modi hai toh mumkin hai""; ""Go Corona Go"") sit beside a serious record on reservations and Scheduled-Caste welfare — a politician who legislates in prose and campaigns in rhyme. डू","Hon'ble Shri Ramdas Bandu Athawale — born 25 December 1959 in Agalgaon, Sangli — is Dalit Maharashtra's most visible political couplet-maker. Founder-President of the Republican Party of India (Athawale) since 1999, Rajya Sabha MP since 2014 (re-elected unopposed 2020), and continuously Union Minister of State for Social Justice and Empowerment since 2016 through Modi 3. 0, he is Marathi poet, Ambedkarite, Buddhist and film actor rolled into one. His rhyming Hindi verses (""Modi hai toh mumkin hai""; ""Go Corona Go"") sit beside a serious record on reservations and Scheduled-Caste welfare — a politician who legislates in prose and campaigns in rhyme. डू"
usr_5f35fdb55e4d4d6cbcca,Ramdas Athawale,honours,"Ranked the second-best performing member of the 14th Lok Sabha by Social Watch India (c. 2009). Known for viral Hindi rhyming couplets (""Modi hai toh mumkin hai""; ""Go Corona Go"" — March 2020). No Padma award on record. Marathi poet, social activist, film actor; actor in Marathi films Anyayacha Pratikar (title role) and Joshi ki Kamble, and in dramas including Ekach Pyala. Editor of the weekly magazine Bhumika. Founder- member, Parivartan Sahitya Mahamandal. National President, Rail Mazdoor Union","Ranked the second-best performing member of the 14th Lok Sabha by Social Watch India (c. 2009). Known for viral Hindi rhyming couplets (""Modi hai toh mumkin hai""; ""Go Corona Go"" — March 2020). Marathi poet, social activist, film actor; actor in Marathi films Anyayacha Pratikar (title role) and Joshi ki Kamble, and in dramas including Ekach Pyala. Editor of the weekly magazine Bhumika. Founder- member, Parivartan Sahitya Mahamandal. National President, Rail Mazdoor Union"
usr_5f35fdb55e4d4d6cbcca,Ramdas Athawale,qualifications,"12th Pass / Inter Arts (1972–73), Siddharth College of Arts and Science, Fort, Mumbai. Attended (not completed) Siddharth College of Law, Mumbai. No earned post-graduate or doctoral qualification","12th Pass / Inter Arts (1972–73), Siddharth College of Arts and Science, Fort, Mumbai. No earned post-graduate or doctoral qualification"
usr_8207d86909dd42f1a6ca,Amita Kshatriya,bio,"Ms. Amita Kshatriya serves as Managing Director of Being Woke, working alongside Ms. Nikita S. Kshatriya in the young brand's leadership. As with many principals of early-stage Indian beauty houses, her public footprint is modest and her biography is not yet a matter of open record. In the spirit of diplomatic accuracy, the register acknowledges her operational role at Being Woke without ascribing unverified honours, and leaves any familial description to be settled with the delegates themselves.","Ms. Amita Kshatriya serves as Managing Director of Being Woke, working alongside Ms. Nikita S. Kshatriya in the young brand's leadership. As with many principals of early-stage Indian beauty houses, her public footprint is modest and her biography is not yet a matter of open record"
usr_3f41674c8ace4a5db20f,Sunil Manjarekar,bio,"Dr. Sunil Manjarekar is a Dubai-based quality and compliance specialist with nearly three decades in ISO standards, food safety and occupational health. As founder and Chief Executive Officer of Sanbook Quality Consultancy, established in 2005, he has advised more than two hundred and fifty organisations across the GCC, India, Africa and Europe, with particular depth in perfume and cosmetics GMP and Halal integrity. As President of GMBF Global, the Gulf Maharashtra Business Forum, he has shaped the MahaBiz convention into a working bridge between Maharashtrian enterprise and Middle Eastern and African markets — an understated practitioner of cross-border commerce.","Dr. Sunil Manjarekar is a Dubai-based quality and compliance specialist with nearly three decades in ISO standards, food safety and occupational health. As founder and Chief Executive Officer of Sanbook Quality Consultancy, established in 2005, he has advised more than two hundred and fifty organisations across the GCC, India, Africa and Europe, with particular depth in perfume and cosmetics GMP and Halal integrity. As President of GMBF Global, the Gulf Maharashtra Business Forum, he has shaped the MahaBiz convention into a working bridge between Maharashtrian enterprise and Middle Eastern and African markets — an understated practitioner of cross-border commerce"
usr_ea7208ad4dd94c468e81,Raaj Lalchandani,bio,"Mr. Raaj Lalchandani is the proprietor, publisher and editor of The Sindhian, a Mumbai-based quarterly coffee-table magazine that has, for over a decade, served as a cultural mirror for the Sindhi diaspora scattered across India and the world. Operating from Khar West, the magazine chronicles the enterprise, artistry and resilience of a community uprooted by Partition and re-rooted across continents. His work sits squarely within the wider effort of Sindhi heritage preservation — quiet, consistent, custodial — offering the community a print home of its own.","Mr. Raaj Lalchandani is the proprietor, publisher and editor of The Sindhian, a Mumbai-based quarterly coffee-table magazine that has, for over a decade, served as a cultural mirror for the Sindhi diaspora scattered across India and the world. Operating from Khar West, the magazine chronicles the enterprise, artistry and resilience of a community uprooted by Partition and re-rooted across continents. His work sits squarely within the wider effort of Sindhi heritage preservation — quiet, consistent, custodial — offering the community a print home of its own"
usr_ea7208ad4dd94c468e81,Raaj Lalchandani,qualifications,"B.Com (The Rajkumar College, India)","B. Com (The Rajkumar College, India)"
usr_f1062ac46ddd4592a35b,Baqar Nasser,designation,"Director, Topspin India Health Care Private Limited, Mumbai; founder, Baqar's Premier League and Bike with Baqar; Weight-Loss and Fitness Coach, OrthoPro Clinic, Dubai",
usr_f1062ac46ddd4592a35b,Baqar Nasser,bio,"Mr. Baqar Nasser is India's pioneer of indoor cycling and a celebrity fitness trainer whose Mumbai studio, Topspin, established in 2003, first brought heart-rate-zone-driven spin culture to the country. An eleven-time national cycling medallist and three-time All-India University champion, he was named ""Fitness Doctor"" by The Economic Times in 2018 and was the first fitness professional from India to be granted the UAE Golden Visa. His clientele has spanned Sanjay Dutt, Priyanka Chopra, Saif Ali Khan and Neil Nitin Mukesh; his global league draws participants from India, the Gulf, Asia, the Americas, Tanzania and Europe.","Mr. His clientele has spanned Sanjay Dutt, Priyanka Chopra, Saif Ali Khan and Neil Nitin Mukesh; his global league draws participants from India, the Gulf, Asia, the Americas, Tanzania and Europe"
usr_f1062ac46ddd4592a35b,Baqar Nasser,honours,"Titled ""Fitness Doctor"" by The Economic Times (2018); eleven National Cycling Medals; three- time All-India University Cycling Champion (1999–2002); Best Sportsman of the Year, Mumbai University (2001–02); first fitness professional from India to receive the UAE Golden Visa; pioneer of indoor/spin cycling in India, having founded the first Topspin studio in New Delhi in 2003",
usr_79d60c25e44e45f99052,Firoz Mosin Bootwala,bio,"Mr. Firoz Mosin Bootwala is the co-founder, gemologist and designer behind Merlion Jewels, the Mumbai jewellery house he established with his wife Fatema at 33, Forjett Street, Tardeo, and its contemporary offshoot, Faya by Merlion Jewels. With two decades in precious and semi-precious gemstones — ruby, amber, agate, pearl and lab- grown diamonds — he has built a quietly enduring Bohra jewellery practice with a carefully curated international gemstone network. His work marries the craft of the bench with the ethics of the bench — each stone sourced personally from its origin, each commission treated as an heirloom in the making.","Mr. With two decades in precious and semi-precious gemstones — ruby, amber, agate, pearl and lab- grown diamonds — he has built a quietly enduring Bohra jewellery practice with a carefully curated international gemstone network. His work marries the craft of the bench with the ethics of the bench — each stone sourced personally from its origin, each commission treated as an heirloom in the making"
usr_e2fc981142cf4cc0a5a8,Fatema Bootwala,bio,"Ms. Fatema Bootwala is the founder and creative director of Faya by Merlion Jewels, a Mumbai luxury jewellery label she conceived with her husband Firoz Bootwala and expanded into the United States. A Graduate Gemologist of the Gemological Institute of America, she personally sources every gemstone from its country of origin, with particular signatures in Baltic Amber Tasbihs, Ya Fatema pendants for the Bohra community, and lab-grown diamond solitaires. Alongside jewellery, she co-founded FAAB52 Botanicals and Wild and Roots, carrying a designer's sensitivity from stone to skin to scent.","Ms. A Graduate Gemologist of the Gemological Institute of America, she personally sources every gemstone from its country of origin, with particular signatures in Baltic Amber Tasbihs, Ya Fatema pendants for the Bohra community, and lab-grown diamond solitaires. Alongside jewellery, she co-founded FAAB52 Botanicals and Wild and Roots, carrying a designer's sensitivity from stone to skin to scent"
usr_e2fc981142cf4cc0a5a8,Fatema Bootwala,qualifications,"G.G. — Graduate Gemologist, Gemological Institute of America (GIA)","G. G. — Graduate Gemologist, Gemological Institute of America (GIA)"
usr_25fb4f8ab25b4ef0b320,Ammin Umer Rajqotwala,designation,"Chairman and Managing Director, Appletree International Pvt. Ltd.; Founder-Director, Rare Hospitality and Services Pvt. Ltd.; Director, EdSanta Inc., OneSIS and Appletree Nutraceuticals, Mumbai","Chairman and Managing Director, Appletree International Pvt. Ltd. ; Founder-Director, Rare Hospitality and Services Pvt. Ltd. ; Director, EdSanta Inc. , OneSIS and Appletree Nutraceuticals, Mumbai"
usr_25fb4f8ab25b4ef0b320,Ammin Umer Rajqotwala,address,"601 Panju Mahal, B.J. Road, Bandstand, Bandra (W), Mumbai 400050","601 Panju Mahal, B. J. Road, Bandstand, Bandra (W), Mumbai 400050"
usr_25fb4f8ab25b4ef0b320,Ammin Umer Rajqotwala,bio,"Mr. Ammin Umer Rajqotwala is a Mumbai hospitality entrepreneur whose career began in 1989 and today spans three decades under the Rare Group umbrella. Hotel Management trained in Mumbai and Oxford, with formative years at the Taj Mahal Hotel and the Palace of His Royal Highness of Bahrain, he presides as Chairman and Managing Director of Appletree International, the parent of the Brooks Hotels and Eatsmart brands serving corporate houses, super-speciality hospitals and fine-dining clients. A serial entrepreneur and start-up mentor, his portfolio now extends into education and nutraceuticals — a hospitable hand across adjacent hospitable worlds.","Mr. Ammin Umer Rajqotwala is a Mumbai hospitality entrepreneur whose career began in 1989 and today spans three decades under the Rare Group umbrella. Hotel Management trained in Mumbai and Oxford, with formative years at the Taj Mahal Hotel and the Palace of His Royal Highness of Bahrain, he presides as Chairman and Managing Director of Appletree International, the parent of the Brooks Hotels and Eatsmart brands serving corporate houses, super-speciality hospitals and fine-dining clients. A serial entrepreneur and start-up mentor, his portfolio now extends into education and nutraceuticals — a hospitable hand across adjacent hospitable worlds"
usr_20a765288f064568a167,Mikki Koomar,designation,"Founder and Global Chairman, Xtreme Industries and Xtreme Entertainment Production Private Limited; Founder and International Chairman, United Nexus organisation; Global Ambassador and Advisor, Eurasia Afro Chamber of Commerce",
usr_20a765288f064568a167,Mikki Koomar,organization,Xtreme Industries and Xtreme Entertainment Production Private Limited,
usr_20a765288f064568a167,Mikki Koomar,bio,"Dr. Mikki Koomar is the Founder and Global Chairman of Xtreme Industries and Xtreme Entertainment Production Pvt. Ltd., and the Founder and International Chairman of the United Nexus organisation, a humanitarian platform aligned with the United Nations Sustainable Development Goals. A model-turned-entrepreneur crowned Indian Male Model 2013, he has parlayed a modelling and martial-arts career into a self-styled global business and diplomatic portfolio spanning entertainment, infrastructure, sustainability, fashion, mining, textiles and digital media. He is widely honoured on the international awards circuit and serves as a World Peace Ambassador to Dr. Khorakiwala's Wockhardt Foundation — a connection that brings him organically into the Conclave fold.","Dr. Mikki Koomar is the Founder and Global Chairman of Xtreme Industries and Xtreme Entertainment Production Pvt. Ltd. , and the Founder and International Chairman of the United Nexus organisation, a humanitarian platform aligned with the United Nations Sustainable Development Goals. He is widely honoured on the international awards circuit and serves as a World Peace Ambassador to Dr. Khorakiwala's Wockhardt Foundation — a connection that brings him organically into the Conclave fold"
usr_20a765288f064568a167,Mikki Koomar,honours,"Indian Male Model 2013 (International Fashion Designers); former-Prime-Minister Rajiv Gandhi Global Excellence Award (International Youth Icon); Bharat Ratan Dr. A.P.J. Abdul Kalam Award (International Youth Icon), presented by Shri Bhagat Singh Koshyari (Governor of Maharashtra) and Shri Ramdas Athawale; Human Excellence Golden Award (Nelson Mandela Peace University); Wockhardt Foundation World Peace Ambassador; Xtreme Entertainment Production Pvt. Ltd. (CIN U92412MH2012PTC229756) founded 1 January 2009 and incorporated 16 April 2012","Indian Male Model 2013 (International Fashion Designers); former-Prime-Minister Rajiv Gandhi Global Excellence Award (International Youth Icon); Bharat Ratan Dr. A. P. J. Abdul Kalam Award (International Youth Icon), presented by Shri Bhagat Singh Koshyari (Governor of Maharashtra) and Shri Ramdas Athawale; Human Excellence Golden Award (Nelson Mandela Peace University); Wockhardt Foundation World Peace Ambassador; Xtreme Entertainment Production Pvt. Ltd"
usr_20a765288f064568a167,Mikki Koomar,qualifications,"Honorary Doctorates (multiple, self-reported)",Honorary Doctorates
