id,name,field,old,new
usr_8853203d42f9429d8a77,Naveen Singh Suhag,bio,"Dr Naveen Singh Suhag — Hansraj College to Zurich University, earned Sport Science doctorate, Olympic-style wrestler who has represented both India and Switzerland — is the Zurich-based co-founder and CEO of Inery, a layer-1 blockchain and decentralised database management system he launched in 2018 with CTO Ivan Vujic to solve the siloing and insecurity of centralised databases. Best NRI Businessman at the 24th Newspaper Association of India National Achievement Awards (2016) and Pravasi Haryana Samaan (2017), he sits on health-tech boards across Switzerland, the UAE and Montenegro — a Haryanvi wrestler-turned-philosopher-CEO who translates databases into a dream of decentralisation.","Dr Naveen Singh Suhag — Hansraj College to Zurich University, earned Sport Science doctorate, Olympic-style wrestler who has represented both India and Switzerland — is the Zurich-based co-founder and CEO of Inery, a layer-1 blockchain and decentralised database management system he launched in 2018 with CTO Ivan Vujic to solve the siloing and insecurity of centralised databases. Best NRI Businessman at the 24th Newspaper Association of India National Achievement Awards (2016) and Pravasi Haryana Samaan (2017), he sits on health-tech boards across Switzerland, the UAE and Montenegro — a Haryanvi wrestler-turned-philosopher-CEO who translates databases into a dream of decentralisation"
usr_5def63f3c1b2473f9518,Sanjay Siroya,designation,"Chairman (stated register title), Siroya Infrastructure Pvt. Ltd. — Mumbai. Concurrently Director and Individual Promoter across multiple group companies: Siroya Infrastructure Private Limited; Sanjay Gems Pvt. Ltd.; Shalibhadra Gruha Nirman Private Limited; Silvershine Agrotech Private Limited. Former directorships include Siroya Exports Private Limited and historical positions in Silvershine Agrotech","Chairman (stated register title), Siroya Infrastructure Pvt. Ltd. — Mumbai"
usr_5def63f3c1b2473f9518,Sanjay Siroya,bio,"Mr Sanjay Bakhtawarmal Siroya — DIN 00785035, 40 years on Indian corporate boards — chairs Siroya Infrastructure Pvt. Ltd. from the 72nd door of Bajaj Bhavan on Nariman Point, where he also directs Sanjay Gems, Shalibhadra Gruha Nirman and Silvershine Agrotech alongside his wife Harsha. The broader Siroya Group, Dubai- headquartered, traces itself to the 1950 Zaveri Bazaar silver unit of patriarch Bastimal Siroya and today spans jewellery, construction (3 million sq ft across Mumbai and Dubai), mining, pharma and manufacturing with a ₹3,500- crore turnover. A diaspora patriarch whose son Rishabh already runs the next chapter.","Ltd. from the 72nd door of Bajaj Bhavan on Nariman Point, where he also directs Sanjay Gems, Shalibhadra Gruha Nirman and Silvershine Agrotech alongside his wife Harsha. The broader Siroya Group, Dubai- headquartered, traces itself to the 1950 Zaveri Bazaar silver unit of patriarch Bastimal Siroya and today spans jewellery, construction (3 million sq ft across Mumbai and Dubai), mining, pharma and manufacturing with a ₹3,500- crore turnover. A diaspora patriarch whose son Rishabh already runs the next chapter"
usr_5def63f3c1b2473f9518,Sanjay Siroya,honours,"Corporate footprint (DIN 00785035): Siroya Infrastructure Private Limited — registered office 72, Bajaj Bhavan, Nariman Point, Mumbai, Maharashtra 400021; his spouse Mrs Harsha Sanjay Siroya (DIN 05341061) is co-director (appointed 16 August 2018). Parallel directorships: Sanjay Gems Pvt. Ltd. (jewellery); Shalibhadra Gruha Nirman Pvt. Ltd.; Silvershine Agrotech Pvt. Ltd. (also shared with Harsha; related to S.S. Star Agrotech Pvt. Ltd. at the same Bajaj Bhavan address). The broader Siroya Group — headquartered Dubai, UAE — with an annual turnover of approximately ₹3,500 crores; active in Jewellery, Construction, Mining, Pharma and Manufacturing; construction arm has delivered more than 3 million square feet across Mumbai and Dubai since its start in the early 1990s. Son Rishabh Siroya founded Siroya Corp and was elected President, NAREDCO NEXTGEN Maharashtra in 2024. No Padma or equivalent civic honour to the subject independently verified","Parallel directorships: Sanjay Gems Pvt. Ltd. (jewellery); Shalibhadra Gruha Nirman Pvt. Ltd. ; Silvershine Agrotech Pvt. Ltd. (also shared with Harsha; related to S. S. Star Agrotech Pvt. Ltd. at the same Bajaj Bhavan address). The broader Siroya Group — headquartered Dubai, UAE — with an annual turnover of approximately ₹3,500 crores; active in Jewellery, Construction, Mining, Pharma and Manufacturing; construction arm has delivered more than 3 million square feet across Mumbai and Dubai since its start in the early 1990s. Son Rishabh Siroya founded Siroya Corp and was elected President, NAREDCO NEXTGEN Maharashtra in 2024"
usr_5def63f3c1b2473f9518,Sanjay Siroya,qualifications,Not publicly documented as specific qualifications. 40 years in corporate governance (per Company Check) suggests career commencement c. 1985,40 years in corporate governance (per Company Check) suggests career commencement c. 1985
usr_b3fcc4758ddc437cb748,Imran Reza Ansari,bio,"Molvi Imran Reza Ansari — born 7 March 1972 into Kashmir's most prominent Shia cleric-politician household — succeeded his father Iftikhar Hussain Ansari in 2014 as life President of the All J&K Shia Association, MLA from Pattan and Wakil of Grand Ayatollah Sistani. His education runs through Tyndale Biscoe, Jamia Millia Islamia, Damascus and eight Syrian years at Howzeh Zainabiyyah, five more at Qom Hawza. Minister of IT, Technical Education, Youth Services and Sports 2015–2018 before leaving PDP for the People's Conference in 2018 as its General Secretary. A July 2025 Muharram-podium controversy with the Muttahida Majlis-e-Ulama remains a recent community shadow; the subject denied interpretation.","Molvi Imran Reza Ansari — born 7 March 1972 into Kashmir's most prominent Shia cleric-politician household — succeeded his father Iftikhar Hussain Ansari in 2014 as life President of the All J&K Shia Association, MLA from Pattan and Wakil of Grand Ayatollah Sistani. His education runs through Tyndale Biscoe, Jamia Millia Islamia, Damascus and eight Syrian years at Howzeh Zainabiyyah, five more at Qom Hawza. Minister of IT, Technical Education, Youth Services and Sports 2015–2018 before leaving PDP for the People's Conference in 2018 as its General Secretary. A July 2025 Muharram-podium controversy with the Muttahida Majlis-e-Ulama remains a recent community shadow; the subject denied interpretation"
usr_b3fcc4758ddc437cb748,Imran Reza Ansari,honours,"Elected MLA Pattan constituency December 2014 on PDP ticket with 14,000+ vote margin (over the then-sitting MLA). Cabinet Minister Government of J&K 2015–2018. Life-tenure President of the All J&K Shia Association — a post held by his grandfather Molvi Muhammad Jawad Ansari and his father Iftikhar Hussain Ansari before him. No Padma award independently verified","Elected MLA Pattan constituency December 2014 on PDP ticket with 14,000+ vote margin (over the then-sitting MLA). Cabinet Minister Government of J&K 2015–2018. Life-tenure President of the All J&K Shia Association — a post held by his grandfather Molvi Muhammad Jawad Ansari and his father Iftikhar Hussain Ansari before him"
usr_aa563ea7c1ad4a4b9287,Deepak Kumar Thakur,designation,"Chairman and Founder, Balabel Group (Muscat, Sultanate of Oman) — verified via the group's own leadership page and LinkedIn company profile. Group span: metallurgy, mining, EPC & civil engineering, automotive engineering, and commodity trading. Anchor clients include Jindal Shadeed Iron & Steel LLC (Oman) and other Gulf industrial majors","Group span: metallurgy, mining, EPC & civil engineering, automotive engineering, and commodity trading. Anchor clients include Jindal Shadeed Iron & Steel LLC (Oman) and other Gulf industrial majors"
usr_aa563ea7c1ad4a4b9287,Deepak Kumar Thakur,bio,"Mr Deepak Kumar Thakur — Oman-based Indian-diaspora industrialist — founded and chairs Balabel Group from Muscat, where since its 2014 operational start the group has moved across metallurgy, mining, EPC and civil engineering, automotive engineering and commodity trading, anchored by Gulf industrial clients including Jindal Shadeed Iron & Steel. In April 2024 he extended the footprint to India through the incorporation of Balabel India Private Limited in Dwarka, New Delhi, alongside his son Yash Thakur (Group MD / Vice Chairman). Attends the Conclave from the quiet-industrialist end of the India–Gulf corridor.","Mr Deepak Kumar Thakur — Oman-based Indian-diaspora industrialist — founded and chairs Balabel Group from Muscat, where since its 2014 operational start the group has moved across metallurgy, mining, EPC and civil engineering, automotive engineering and commodity trading, anchored by Gulf industrial clients including Jindal Shadeed Iron & Steel. Attends the Conclave from the quiet-industrialist end of the India–Gulf corridor"
usr_aa563ea7c1ad4a4b9287,Deepak Kumar Thakur,honours,"Corporate footprint: Balabel Group — commercially registered in Oman 2006, commercial operations commenced 2014. Indian subsidiary: Balabel India Private Limited — CIN U42900DL2024PTC429373, incorporated 4 April 2024, registered office Sahara Apartments, Sector 6, Dwarka, New Delhi; directors Deepak Kumar, Yash Vardhan and Kumkum Rani. Attended Oman–India Business Dialogue hosted by the Oman Chamber of Commerce & Industry (OCCI) 2024; met then-MoS External Affairs V. Muraleedharan in Muscat. No Padma award verified","Corporate footprint: Balabel Group — commercially registered in Oman 2006, commercial operations commenced 2014. Attended Oman–India Business Dialogue hosted by the Oman Chamber of Commerce & Industry (OCCI) 2024; met then-MoS External Affairs V. Muraleedharan in Muscat"
usr_aa563ea7c1ad4a4b9287,Deepak Kumar Thakur,qualifications,"Formal academic qualifications not publicly disclosed on verifiable sources. Self- described in group materials as ""Entrepreneur and Philanthropist""","Self- described in group materials as ""Entrepreneur and Philanthropist"""
usr_2b5ef084bf754bc3a65b,Anup Kumar Singh,designation,"Principal Secretary (Special), Home Department, Government of Maharashtra, Mantralaya, Mumbai — confirmed on the Home Department's own ""Administrative Setup"" page. Reports into the hierarchy under the Chief Minister Shri Devendra Fadnavis's Home portfolio. Peer Secretaries include Dr Iqbal Singh Chahal (ACS– Home), Smt Radhika Rastogi (ACS–Appeals & Security), Shri Sanjay Sethi (ACS–Transport), Shri Milind Mhaiskar (ACS–Excise)","Reports into the hierarchy under the Chief Minister Shri Devendra Fadnavis's Home portfolio. Peer Secretaries include Dr Iqbal Singh Chahal (ACS– Home), Smt Radhika Rastogi (ACS–Appeals & Security), Shri Sanjay Sethi (ACS–Transport), Shri Milind Mhaiskar (ACS–Excise)"
usr_2b5ef084bf754bc3a65b,Anup Kumar Singh,bio,"Shri Anup Kumar Singh, IPS — Maharashtra cadre, 1994 batch, and Champion-category BFP attendee (code 9Pe.8) — serves as Principal Secretary (Special) in the Home Department of the Government of Maharashtra at Mantralaya, Mumbai, under the Fadnavis administration's home portfolio. His career has moved through ADGP (Policy), ADGP (Administration), ADGP (Home Guards) and Principal Secretary (Home) before his present posting. On 29 July 2025 the Hon'ble Governor of Maharashtra Shri C. P. Radhakrishnan pinned the President's Police Medal for Distinguished Service on him at a Raj Bhavan investiture. Mantralaya's quiet administrator rather than its public face, he carries into the Conclave the weight of the Home Secretariat's seal.","Shri Anup Kumar Singh, IPS — Maharashtra cadre, 1994 batch, and Champion-category BFP attendee (code 9Pe. 8) — serves as Principal Secretary (Special) in the Home Department of the Government of Maharashtra at Mantralaya, Mumbai, under the Fadnavis administration's home portfolio. His career has moved through ADGP (Policy), ADGP (Administration), ADGP (Home Guards) and Principal Secretary (Home) before his present posting. On 29 July 2025 the Hon'ble Governor of Maharashtra Shri C. P. Radhakrishnan pinned the President's Police Medal for Distinguished Service on him at a Raj Bhavan investiture. Mantralaya's quiet administrator rather than its public face, he carries into the Conclave the weight of the Home Secretariat's seal"
usr_9781e1ecc9644604aec6,Vanki Penchalaiah,designation,"Founder Chairman, Audisankara Group of Educational Institutions, Gudur, Tirupati District, Andhra Pradesh. The register's current styling ""Chairman, Audisankara Deemed University"" reflects a claim that the group announces on its own platforms as having attained Deemed-to-be-University status in the middle of 2025. ⚠ This claim could not be independently confirmed against the canonical UGC list of Deemed-to-be- Universities at the time of verification — see note","Founder Chairman, Audisankara Group of Educational Institutions, Gudur, Tirupati District, Andhra Pradesh. The register's current styling ""Chairman, Audisankara Deemed University"" reflects a claim that the group announces on its own platforms as having attained Deemed-to-be-University status in the middle of 2025"
usr_9781e1ecc9644604aec6,Vanki Penchalaiah,bio,"Dr V. Penchalaiah is the Gudur-based Founder Chairman of the Audisankara Group of Educational Institutions — comprising Audisankara College of Engineering & Technology (2001) and Audisankara Institute of Technology (2008), both run under the Aishwarya Vignan Educational Society on NH-16 bypass in rural Nellore District, Andhra Pradesh. The cluster is widely recognised as JNTUA-affiliated and NAAC A+ / NBA-accredited, and its library was inaugurated on 12 August 2008 by former PM H. D. Deve Gowda. The 2025 claim of having attained ""Deemed to be University"" status is self-published on institutional platforms and could not be independently corroborated against the canonical UGC list at the time of verification — the Conclave print material should retain the earned Autonomous / JNTUA styling until the UGC notification is produced.","Dr V. Penchalaiah is the Gudur-based Founder Chairman of the Audisankara Group of Educational Institutions — comprising Audisankara College of Engineering & Technology (2001) and Audisankara Institute of Technology (2008), both run under the Aishwarya Vignan Educational Society on NH-16 bypass in rural Nellore District, Andhra Pradesh. The cluster is widely recognised as JNTUA-affiliated and NAAC A+ / NBA-accredited, and its library was inaugurated on 12 August 2008 by former PM H. D. Deve Gowda"
usr_9781e1ecc9644604aec6,Vanki Penchalaiah,honours,"Corporate / institutional footprint: Founder of Audisankara College of Engineering & Technology (ASCET) — established 2001, Autonomous, NAAC A+/NBA-accredited, affiliated to JNTUA Anantapur — and Audisankara Institute of Technology (ASIT) — established 2008. Both located on NH-16 (formerly NH-5) bypass, Aravinda Nagar, Gudur 524101, Nellore District, Andhra Pradesh. Trusts: Aishwarya Vignan Educational Society / Aishwarya Educational Trust. Philanthropic recognition: 10% free management-quota seats for poor rural students (self-described). Campus located 3 km from Gudur town and 38 km from Nellore. The ASCET library was inaugurated on 12 August 2008 by former Prime Minister Shri H. D. Deve Gowda. No Padma award on padmaawards.gov.in","Corporate / institutional footprint: Founder of Audisankara College of Engineering & Technology (ASCET) — established 2001, Autonomous, NAAC A+/NBA-accredited, affiliated to JNTUA Anantapur — and Audisankara Institute of Technology (ASIT) — established 2008. Both located on NH-16 (formerly NH-5) bypass, Aravinda Nagar, Gudur 524101, Nellore District, Andhra Pradesh. Trusts: Aishwarya Vignan Educational Society / Aishwarya Educational Trust. Campus located 3 km from Gudur town and 38 km from Nellore. The ASCET library was inaugurated on 12 August 2008 by former Prime Minister Shri H. D. Deve Gowda"
usr_9781e1ecc9644604aec6,Vanki Penchalaiah,qualifications,Ph.D. appended on Audisankara Founder-Chairman page (conferring institution not publicly published). Earned-vs-honorary distinction flagged as pending ~,Ph. D. Earned-vs-honorary distinction flagged as pending ~
usr_55b997200da74c08bd9a,Vinay Tejuja,designation,"Founder and Chief Executive Officer, Web Fusion Publishing (Mumbai-based niche publishing firm providing print-media marketing collateral to multinational corporates in Healthcare, Finance and Banking; registered GSTIN 27AABFW6005C1ZK; HQ Nariman Point, Mumbai). Concurrently Managing Director, Amkri Tech Services Pvt. Ltd. (outsourcing-focused group he established with three divisions: Call Centre, Data Research Centre, and Recruitment Outsourcing — all exclusively for international markets). Also Director at Viporabh Publishing Private Limited and Sabvin Computer Systems Pvt. Ltd. Total 4 concurrent directorships; 15+ years in corporate governance","Concurrently Managing Director, Amkri Tech Services Pvt. Ltd. (outsourcing-focused group he established with three divisions: Call Centre, Data Research Centre, and Recruitment Outsourcing — all exclusively for international markets). Ltd. Total 4 concurrent directorships; 15+ years in corporate governance"
usr_55b997200da74c08bd9a,Vinay Tejuja,bio,"Mr Vinay Ashok Tejuja — NMIMS-trained (MMS / MBA Marketing), DIN 03229059, fifteen years on Indian boards — founded Amkri Tech Services Pvt. Ltd. as an international-facing outsourcing platform across call-centre, data- research and recruitment streams before building Web Fusion Publishing into a niche print-media marketing house for Healthcare, Finance and Banking multinationals from offices in Nariman Point, Mumbai. His spouse Sonali Vinay Tejuja holds concurrent directorships on three related technology LLPs. A quiet family-led outsourcing-and- publishing operator, not a public-markets founder.","Ltd. as an international-facing outsourcing platform across call-centre, data- research and recruitment streams before building Web Fusion Publishing into a niche print-media marketing house for Healthcare, Finance and Banking multinationals from offices in Nariman Point, Mumbai. His spouse Sonali Vinay Tejuja holds concurrent directorships on three related technology LLPs. A quiet family-led outsourcing-and- publishing operator, not a public-markets founder"
usr_55b997200da74c08bd9a,Vinay Tejuja,honours,"Corporate footprint: Web Fusion Publishing specialises in integrated marketing collateral for international publishing houses and multinational clients — offering Page Designing, Content Development and Printing under one roof, plus Administrative Outsourcing Services (Virtual Administrative Assistants) for overseas businesses. 12+ years of operations. No Padma award verified","Corporate footprint: Web Fusion Publishing specialises in integrated marketing collateral for international publishing houses and multinational clients — offering Page Designing, Content Development and Printing under one roof, plus Administrative Outsourcing Services (Virtual Administrative Assistants) for overseas businesses. 12+ years of operations"
usr_83fca53059094d30b292,Suraj Chouhan,designation,"Founder and Managing Partner, Chouhan Automobiles LLP (the only Maruti Suzuki ARENA dealership in Bhilai, Chhattisgarh; registered address PL-33, Chouhan State, G.E. Road, Bhilai–Durg 490023 with principal showroom on NH-6 / Rajnandgaon Bypass Road, near Chouhan Town). Concurrently Director, Chouhan Housing Private Limited (since 2017) — the Chouhan Group's real-estate arm; and part of the broader Chouhan Group which spans Automobiles, Hotel (Empyrean Lake Resort, Balod) and Real Estate (Chouhan Park View premium villas, Junwani Road, Bhilai)","Founder and Managing Partner, Chouhan Automobiles LLP (the only Maruti Suzuki ARENA dealership in Bhilai, Chhattisgarh; registered address PL-33, Chouhan State, G. E. Road, Bhilai–Durg 490023 with principal showroom on NH-6 / Rajnandgaon Bypass Road, near Chouhan Town)"
usr_83fca53059094d30b292,Suraj Chouhan,bio,"Mr Suraj Chouhan — US-educated (BBA, University of St. Thomas) and Pune-finished (MBA, Bharati Vidyapeeth) — anchors the automobile vertical of the Chhattisgarh-headquartered Chouhan Group from Bhilai, where he founded and manages the only Maruti Suzuki ARENA dealership in town as Chouhan Automobiles LLP (LLPIN AAJ-8498, incorporated 30 June 2017, total obligation ₹10 crore). His father Ajay Chouhan chairs the broader Chouhan Group — spanning real estate (Chouhan Park View villas, Chouhan Housing Pvt. Ltd.) and hospitality (Empyrean Lake Resort, Balod). A regional family-conglomerate heir for whom Bhilai is both hometown and core market.","Mr Suraj Chouhan — US-educated (BBA, University of St. His father Ajay Chouhan chairs the broader Chouhan Group — spanning real estate (Chouhan Park View villas, Chouhan Housing Pvt. Ltd. ) and hospitality (Empyrean Lake Resort, Balod). A regional family-conglomerate heir for whom Bhilai is both hometown and core market"
usr_83fca53059094d30b292,Suraj Chouhan,honours,"Corporate footprint: Chouhan Automobiles LLP — LLPIN AAJ-8498; incorporated 30 June 2017 (per ZaubaCorp records; commercial commencement 6 March 2018 per dealership website); registered with Registrar of Companies, Chhattisgarh; total obligation of contribution ₹10,00,00,000 (₹10 crore); status Active; Designated Partners Ajay Kumar Chouhan, Suraj Chouhan and Sunny Chouhan. Dealer network spans 1 Showroom | 2 Workshops | 1 True Value Outlet | 1 Driving School | 1 Commercial outlet | 2 Festive Outlets across Chhattisgarh. Recent highlights: launch of Maruti Suzuki e Vitara (electric SUV) for Bhilai; visit of Hon'ble Governor of Chhattisgarh Shri Ramen Deka to the Chouhan Group's Empyrean Lake Resort, Balod. No Padma award verified","Dealer network spans 1 Showroom | 2 Workshops | 1 True Value Outlet | 1 Driving School | 1 Commercial outlet | 2 Festive Outlets across Chhattisgarh. Recent highlights: launch of Maruti Suzuki e Vitara (electric SUV) for Bhilai; visit of Hon'ble Governor of Chhattisgarh Shri Ramen Deka to the Chouhan Group's Empyrean Lake Resort, Balod"
usr_76bff53401a74b71a3b1,Patrick Leverino,bio,"H.E. M. Patrick Leverino — formally named Consul General of France in Mumbai by Presidential Decree of 17 October 2025, succeeding M. Jean-Marc Séré-Charlet — is a career French sous-préfet (Administrator of the State, second grade) whose Ministry of the Interior postings from 2016 to 2025 included Largentière and Boulogne-sur- Mer. His consular territory embraces Chhattisgarh, Goa, Gujarat, Madhya Pradesh, Maharashtra and the UTs of Dadra, Nagar Haveli, Daman and Diu. A striking detail for the Conclave: the Consulate General's Mumbai chancery sits on the 5th Floor of Wockhardt Towers East Wing, Bandra Kurla Complex — the same tower complex that houses Dr Huzaifa Khorakiwala's Wockhardt HQ. Host and French envoy share a BKC address.","H. E. M. Patrick Leverino — formally named Consul General of France in Mumbai by Presidential Decree of 17 October 2025, succeeding M. Jean-Marc Séré-Charlet — is a career French sous-préfet (Administrator of the State, second grade) whose Ministry of the Interior postings from 2016 to 2025 included Largentière and Boulogne-sur- Mer. His consular territory embraces Chhattisgarh, Goa, Gujarat, Madhya Pradesh, Maharashtra and the UTs of Dadra, Nagar Haveli, Daman and Diu. A striking detail for the Conclave: the Consulate General's Mumbai chancery sits on the 5th Floor of Wockhardt Towers East Wing, Bandra Kurla Complex — the same tower complex that houses Dr Huzaifa Khorakiwala's Wockhardt HQ. Host and French envoy share a BKC address"
usr_76bff53401a74b71a3b1,Patrick Leverino,honours,"⚠ STRIKING ADDRESS COINCIDENCE: The Consulate General of France in Mumbai's chancery is located at Wockhardt Towers, East Wing, 5th Floor, Bandra Kurla Complex, Mumbai 400051 — the same Wockhardt-owned commercial tower complex in BKC that houses Wockhardt Limited's Corporate HQ (Wockhardt Towers, G Block BKC, BKC Bandra East), and by direct extension the offices of Dr Huzaifa Khorakiwala, IAPM founder and BFP Conclave host. Literal daily-office physical proximity between the French Consul General and the Conclave host. French public-service decorations likely (Légion d'honneur / Ordre national du Mérite would be standard for this career grade, but not independently verified in this research window)","STRIKING ADDRESS COINCIDENCE: The Consulate General of France in Mumbai's chancery is located at Wockhardt Towers, East Wing, 5th Floor, Bandra Kurla Complex, Mumbai 400051 — the same Wockhardt-owned commercial tower complex in BKC that houses Wockhardt Limited's Corporate HQ (Wockhardt Towers, G Block BKC, BKC Bandra East), and by direct extension the offices of Dr Huzaifa Khorakiwala, IAPM founder and BFP Conclave host. Literal daily-office physical proximity between the French Consul General and the Conclave host. French public-service decorations likely"
