id,name,field,old,new
usr_b3ab771499414b71adef,Rima Medhi,honours,"Creatiwitty.inc has reportedly trained over 5,000 students since inception (2014) through workshops, personalised modules and online programmes; partnerships with leading educational brands and NCPA Mumbai (Debate Masters by Creatiwitty Inc. youth workshop, 2025). Featured on Indian Speaker Bureau, SpeakIn, and other speaker networks. No state / national civic honours independently verified","Creatiwitty. inc has reportedly trained over 5,000 students since inception (2014) through workshops, personalised modules and online programmemes; partnerships with leading educational brands and NCPA Mumbai (Debate Masters by Creatiwitty Inc. youth workshop, 2025). Featured on Indian Speaker Bureau, SpeakIn, and other speaker networks"
usr_b3ab771499414b71adef,Rima Medhi,qualifications,"Bachelor of Engineering (B.E.), Bharati Vidyapeeth University, Pune. Schooling: St. Anthony's Girls' High School","Bachelor of Engineering (B. E. ), Bharati Vidyapeeth University, Pune. Schooling: St. Anthony's Girls' High School"
usr_6df91cfda4104b9b9d18,Pradeep Hirani,designation,"Proprietor, Hirani Law Senate (boutique law firm, Mumbai). Chairman, Kimaya Fashion Pvt. Ltd. (the internationally recognised Indian luxury fashion brand). Advocate, Arbitrator, and Internationally Accredited Mediator & Conciliator. Dispute Resolution Professional. Specialisations: International Dispute Resolution, Mediation, Conciliation and Arbitration; Commercial Law; Intellectual Property Rights; Cyber Law. Member, Della Leaders Club, Mumbai Chapter","Chairman, Kimaya Fashion Pvt. Ltd. (the internationally recognised Indian luxury fashion brand). Advocate, Arbitrator, and Internationally Accredited Mediator & Conciliator. Dispute Resolution Professional. Specialisations: International Dispute Resolution, Mediation, Conciliation and Arbitration; Commercial Law; Intellectual Property Rights; Cyber Law. Member, Della Leaders Club, Mumbai Chapter"
usr_6df91cfda4104b9b9d18,Pradeep Hirani,bio,"Adv. Pradeep Hirani is a Mumbai portmanteau: NMIMS-trained finance MBA, Lala Lajpatrai law graduate, and the couturier-chairman who built Kimaya into one of India's first multi-designer luxury-fashion houses. Since 1 June 2021 he has run Hirani Law Senate, a boutique firm on Juhu Tara Road specialising in international dispute resolution, mediation, arbitration, commercial law, IPR and cyber law. An accredited mediator and arbitrator still reading for his LLM at K.C. Law College, he is the rare practitioner who can cross-examine a witness at ten and critique a lehenga at five.","Adv. An accredited mediator and arbitrator still reading for his LLM at K. C. Law College, he is the rare practitioner who can cross-examine a witness at ten and critique a lehenga at five"
usr_6df91cfda4104b9b9d18,Pradeep Hirani,honours,"Corporate/firm footprint: Hirani Law Senate — Proprietorship firm incorporated 1 June 2021; registered office Bungalow No. 5, Asha Colony B Co-Op Housing Society Ltd, Santacruz West | 5 Juhu Tara Road | Mumbai — Mumbai Suburban | Maharashtra 400049; firm office B-10, 2nd Floor, Asha Colony, Juhu Tara Road, opposite Hotel Sea Princess; classified Micro enterprise under MSME for FY 2023–24. Parallel entity: Kimaya Fashion Pvt. Ltd. — the Indian luxury fashion retail brand he built and chairs, showcasing designer couture nationally and internationally (credited by Della Leaders Club as his founder-brand). Recognised winner of numerous fashion-industry and legal-profession awards (self-declared LinkedIn, independently uncatalogued here). No Padma award verified","Parallel entity: Kimaya Fashion Pvt. Ltd. — the Indian luxury fashion retail brand he built and chairs, showcasing designer couture nationally and internationally (credited by Della Leaders Club as his founder-brand). Recognised winner of numerous fashion-industry and legal-profession awards (self-declared LinkedIn, independently uncatalogued here)"
usr_6df91cfda4104b9b9d18,Pradeep Hirani,qualifications,"MBA (Finance), Narsee Monjee Institute of Management Studies (NMIMS), Mumbai. LLB, Lala Lajpatrai College of Law, Mumbai. Currently pursuing LLM at K.C. Law College, Mumbai. Undergraduate alumnus of R.D. National College, Mumbai. Additional certifications: Mediation Advocacy (Pravin Gandhi College of Law); Certificate Course on Intellectual Property Rights (LeDroit); Insolvency & Bankruptcy Code certificate course (Fortitude Learning); Digital Signature Movement in India (Capricon); Mediation certificate from Maharashtra National Law University, Mumbai. Bar Council of Maharashtra & Goa enrolment number not independently verified in this research window","MBA (Finance), Narsee Monjee Institute of Management Studies (NMIMS), Mumbai. LLB, Lala Lajpatrai College of Law, Mumbai. Currently pursuing LLM at K. C. Law College, Mumbai. Undergraduate alumnus of R. D. National College, Mumbai"
usr_39e636c4657c41749612,Rashmi Upadhyay,bio,"Ms Rashmi Upadhyay is the Mumbai-based co-founder of Sai Leela Foundation — a Maharashtra-registered society (No. 246/2019) she established on 13 February 2019 with Mr Mahesh Shetty to channel Saibaba's ethic of service into contemporary social programmes: skilling the youth, empowering women and delivering healthcare to the underprivileged. The Foundation's flagship is a three-month Mumbai University pharmaceutical-industry training course with placement guarantees. Alongside she convenes the annual Boost India Conclave, most recently at Taj Lands End in March 2025 — a Kendriya-Vidyalaya alumna turned Mumbai social entrepreneur on a thirteenth-of- February mission.","Ms Rashmi Upadhyay is the Mumbai-based co-founder of Sai Leela Foundation — a Maharashtra-registered society (No. 246/2019) she established on 13 February 2019 with Mr Mahesh Shetty to channel Saibaba's ethic of service into contemporary social programmemes: skilling the youth, empowering women and delivering healthcare to the underprivileged. The Foundation's flagship is a three-month Mumbai University pharmaceutical-industry training course with placement guarantees. Alongside she convenes the annual Boost India Conclave, most recently at Taj Lands End in March 2025 — a Kendriya-Vidyalaya alumna turned Mumbai social entrepreneur on a thirteenth-of- February mission"
usr_39e636c4657c41749612,Rashmi Upadhyay,honours,"Institutional footprint: Sai Leela Foundation — Mumbai-registered society; office address B- Wing, in front of Oxford Chamber, Sakivihar Telephone Exchange Lane, Mumbai. Mission: skilling youth, women empowerment, healthcare ecosystem for the underprivileged. Supports rural education, training, health and environmental causes since inception. Notable programme: has established a 3-month training course for pharmaceutical-industry students in partnership with Mumbai University, with a job-placement guarantee for course graduates. Boost India Conclave / Exhibition / Awards — annual networking-and-recognition platform; 2025 edition 8 March 2025 at Taj Lands End (hosted prominent dignitaries including visits by consular diplomats per Facebook records). No Padma or equivalent state honour verified","Institutional footprint: Sai Leela Foundation — Mumbai-registered society; office address B- Wing, in front of Oxford Chamber, Sakivihar Telephone Exchange Lane, Mumbai. Mission: skilling youth, women empowerment, healthcare ecosystem for the underprivileged. Supports rural education, training, health and environmental causes since inception. Notable programmeme: has established a 3-month training course for pharmaceutical-industry students in partnership with Mumbai University, with a job-placement guarantee for course graduates. Boost India Conclave / Exhibition / Awards — annual networking-and-recognition platform; 2025 edition 8 March 2025 at Taj Lands End (hosted prominent dignitaries including visits by consular diplomats per Facebook records)"
usr_39e636c4657c41749612,Rashmi Upadhyay,qualifications,"Schooling at Kendriya Vidyalaya. Further qualifications not publicly documented. No bar-council, ICAI or medical-council enrolments applicable (not a regulated-profession role)","Schooling at Kendriya Vidyalaya. No bar-council, ICAI or medical-council enrolments applicable (not a regulated-profession role)"
usr_eb6bbd38b9b6441b9e28,Himanshu Dave,designation,"Founder and Chief Executive Officer, InfinityRadar.com (operating brand of Infitron Advanced Systems Pvt. Ltd., incorporated 2020 — an Indian defence-technology company focused on counter-drone, command-and-control and anti-jamming systems). Concurrently Executive Vice President (Defence Technology), Oceans Technologies (since 2024). Founder of the original 2017 proprietary firm Infinity Digital Technology (predecessor banner of Infinity Radar). Part of the broader Sahana System Group (flagship: Sahana System Limited; sister entities include Softvan Pvt Ltd, Softvan Labs Pvt Ltd, Sourceved Technologies, Sahana Defence Limited — formerly Softvan Limited). Group Managing Director: Mr Pratik Kakadia","Founder and Chief Executive Officer, InfinityRadar. com (operating brand of Infitron Advanced Systems Pvt. Ltd. , incorporated 2020 — an Indian defence-technology company focused on counter-drone, command-and-control and anti-jamming systems). Concurrently Executive Vice President (Defence Technology), Oceans Technologies (since 2024). Part of the broader Sahana System Group (flagship: Sahana System Limited; sister entities include Softvan Pvt Ltd, Softvan Labs Pvt Ltd, Sourceved Technologies, Sahana Defence Limited — formerly Softvan Limited). Group Managing Director: Mr Pratik Kakadia"
usr_eb6bbd38b9b6441b9e28,Himanshu Dave,organization,InfinityRadar.com,InfinityRadar. com
usr_eb6bbd38b9b6441b9e28,Himanshu Dave,bio,"Mr Himanshu P. Dave is the Gujarat-based founder-CEO of Infinity Radar (brand) and Infitron Advanced Systems Pvt. Ltd. (2020) — the Patan-headquartered defence-technology company building India's indigenous counter-drone, anti-jamming GPS and command-and-control systems for the Indian Army, Coast Guard and state police. Recognised under the MeitY Start-up Defence scheme, and awarded Make-in-India Initiative of the Year 2022 (Dare to Dream / SAP / TV9), Infitron in November 2024 secured an ISRO TRISP technology transfer promising 58–65% energy savings. A Kanpur University graduate, start-up India son, three-Is man: Information, Integration, Innovation.","Mr Himanshu P. Dave is the Gujarat-based founder-CEO of Infinity Radar (brand) and Infitron Advanced Systems Pvt. Ltd. (2020) — the Patan-headquartered defence-technology company building India's indigenous counter-drone, anti-jamming GPS and command-and-control systems for the Indian Army, Coast Guard and state police. Recognised under the MeitY Start-up Defence scheme, and awarded Make-in-India Initiative of the Year 2022 (Dare to Dream / SAP / TV9), Infitron in November 2024 secured an ISRO TRISP technology transfer promising 58–65% energy savings. A Kanpur University graduate, start-up India son, three-Is man: Information, Integration, Innovation"
usr_eb6bbd38b9b6441b9e28,Himanshu Dave,honours,"Corporate footprint: Infitron Advanced Systems Pvt. Ltd. — since March 2020 led by three women Directors (Mrs Khushboo Brahmshtriya, Mrs Viraj Rana, Mrs Trupti Kansagra), positioning the firm as woman-led; Himanshu P. Dave is Founder and CEO. Registered / postal office 1st floor, Shiv Enclave, Rajmahal Road, Patan 384264, Gujarat. Recognised by the Government of India, Ministry of Electronics and Information Technology as a Start-up in the field of Defence. Prototypes developed: Anti-Drone Module / Anti-Drone Gun; 4- Channel and 6-Channel Controlled Reception Pattern Antenna (CRPA); Anti-Jamming GPS system; portable counter-drone system with hardware-plus-software (command-and-control) AI-based threat classification. Clients include: Indian Army, Indian Coast Guard, and state police forces (including Gujarat Police). Participation: Defence India Startup Challenge — DISC 2 and DISC 3 at competitive level. Awards: Indian Achiever's Forum Award for Emerging Company (Mr Himanshu Dave, CEO); ""Dare to Dream Awards 2022"" powered by SAP in partnership with TV9 Network — Winner, Make-in-India Initiative of the Year 2022; Sneh Foundation Startup Fest 2023 — Best Defence Startup, Gujarat (presented to Mr Himanshu Dave, Founder and CEO). November 2024 milestone: ISRO TRISP (Triple Input Smart Power Supply) technology transfer to Infitron Advanced Systems — Infitron now commercialising this space-grade energy-efficient technology delivering 58–65% energy savings","Corporate footprint: Infitron Advanced Systems Pvt. Ltd. Dave is Founder and CEO. Registered / postal office 1st floor, Shiv Enclave, Rajmahal Road, Patan 384264, Gujarat. Recognised by the Government of India, Ministry of Electronics and Information Technology as a Start-up in the field of Defence. Prototypes developed: Anti-Drone Module / Anti-Drone Gun; 4- Channel and 6-Channel Controlled Reception Pattern Antenna (CRPA); Anti-Jamming GPS system; portable counter-drone system with hardware-plus-software (command-and-control) AI-based threat classification. Clients include: Indian Army, Indian Coast Guard, and state police forces (including Gujarat Police). Participation: Defence India Startup Challenge — DISC 2 and DISC 3 at competitive level. Awards: Indian Achiever's Forum Award for Emerging Company (Mr Himanshu Dave, CEO); ""Dare to Dream Awards 2022"" powered by SAP in partnership with TV9 Network — Winner, Make-in-India Initiative of the Year 2022; Sneh Foundation Startup Fest 2023 — Best Defence Startup, Gujarat (presented to Mr Himanshu Dave, Founder and CEO). November 2024 milestone: ISRO TRISP (Triple Input Smart Power Supply) technology transfer to Infitron Advanced Systems — Infitron now commercialising this space-grade energy-efficient technology delivering 58–65% energy savings"
usr_eb6bbd38b9b6441b9e28,Himanshu Dave,qualifications,"Graduate of Chatrapati Sahuji Maharaj (CSJM) Kanpur University, Kanpur (per RocketReach profile). Earlier career: General Manager at High Level Software Ltd (2014–2017); Partner at Brightly.India (2018–2020). Motto: ""3 I — Information, Integration, Innovation"" (his personal contribution to the Infinity Radar ethos)","Graduate of Chatrapati Sahuji Maharaj (CSJM) Kanpur University, Kanpur (per RocketReach profile). Earlier career: General Manager at High Level Software Ltd (2014–2017); Partner at Brightly. India (2018–2020). Motto: ""3 I — Information, Integration, Innovation"" (his personal contribution to the Infinity Radar ethos)"
usr_db65932b9a9f4e2384ed,Mukesh Mohta,designation,"Chartered Accountant — firm / practice affiliation pending BFP Bureau verification (as noted in the source register). Practice area (statutory audit, direct tax, indirect tax, corporate advisory, insolvency, forensic, fund-raising, etc.) not publicly documented for this specific identity",
usr_db65932b9a9f4e2384ed,Mukesh Mohta,bio,"CA Mukesh Mohta is listed in the BFP Conclave 2026 register as a Chartered Accountant with the source-document candour ""(organisation pending verification)"" — signalling that even the invitation office awaits firm affiliation. Open-source research returns multiple common-name hits across India but no definitive match to the person invited. The dossier file therefore pauses at the threshold. The register awaits the subject's own office to supply ICAI membership number, firm registration, practice area and the basic particulars — without which this entry cannot be written with confidence.",Open-source research returns multiple common-name hits across India but no definitive match to the person invited. The dossier file therefore pauses at the threshold
usr_db65932b9a9f4e2384ed,Mukesh Mohta,qualifications,"Presumed B.Com + ACA/FCA (Institute of Chartered Accountants of India) — standard path for a CA designation — but the specific ICAI membership number, year of admission as ACA/FCA, and Certificate of Practice (COP) number are not independently verified in this research window",
usr_315d054c959a44069ced,Bhupesh Pandey,designation,"Advocate, Supreme Court of India (as listed in the Conclave register). Specific Bar Council enrolment number, year of enrolment, chambers address, and Advocate-on-Record (AOR) status pending BFP Bureau verification. Practice area not independently documented",
usr_315d054c959a44069ced,Bhupesh Pandey,organization,Supreme Court of India (per BFP register; identity not independently verified),
usr_315d054c959a44069ced,Bhupesh Pandey,bio,"Adv. Bhupesh Pandey is listed in the BFP Conclave 2026 register as an Advocate of the Supreme Court of India — but open-source research against the Supreme Court's own 11 November 2024 Advocates-on-Record list and across the common reporting databases returns no definitive match for this specific name. Several other Pandey-surname advocates do practise at the apex court, but none is him. The dossier pauses respectfully at the absence of verifiable particulars. The register awaits his office to supply Bar Council enrolment and chambers address so the entry may be written with the accuracy it deserves.",Adv. The dossier pauses respectfully at the absence of verifiable particulars. The register awaits his office to supply Bar Council enrolment and chambers address so the entry may be written with the accuracy it deserves
usr_315d054c959a44069ced,Bhupesh Pandey,honours,None publicly verifiable against this specific identifier. No designation as Senior Advocate of the Supreme Court located; no reported Supreme Court judgments in which he appears as counsel surfaced in open- source judgment databases under this exact name,None publicly verifiable against this specific identifier
usr_315d054c959a44069ced,Bhupesh Pandey,qualifications,"Presumed LLB (three-year or five-year), possibly LLM; specific institutions not verified. Specific Bar Council of India enrolment number and Supreme Court Bar Association (SCBA) membership number not verifiable in this research window","Presumed LLB (three-year or five-year), possibly LLM; specific institutions not verified"
usr_6ccfc70b38844dd2a716,Zoya Khan,designation,"Correspondent, Indo Gulf Times* — a Mumbai-based, weekly English-language tabloid international newspaper aimed at Non-Resident Indians (NRIs) and the expatriate Indian community in the Gulf region; institutional website indogulftimes.com; Facebook page @indogulftimes. The paper's stated circulation is across Asia, the Middle East, Africa, South East Asia, the Americas, Australia and Europe. The paper's Executive Editor of record is Mr Ahmar Bubere** (Mumbai-based), who is the husband/family of Assistant Editor Zahra Bubere (entry 119)","Correspondent, Indo Gulf Times* — a Mumbai-based, weekly English-language tabloid international newspaper aimed at Non-Resident Indians (NRIs) and the expatriate Indian community in the Gulf region; institutional website indogulftimes. com; Facebook page @indogulftimes. The paper's stated circulation is across Asia, the Middle East, Africa, South East Asia, the Americas, Australia and Europe. The paper's Executive Editor of record is Mr Ahmar Bubere** (Mumbai-based), who is the husband/family of Assistant Editor Zahra Bubere (entry 119)"
usr_6ccfc70b38844dd2a716,Zoya Khan,organization,Indo Gulf Times (per BFP register),
usr_6ccfc70b38844dd2a716,Zoya Khan,bio,"Ms Zoya Khan is listed in the BFP Conclave 2026 register as Correspondent for the Indo Gulf Times — the Mumbai- based weekly tabloid serving NRIs and the Gulf-based Indian diaspora, with a readership spanning Asia, the Middle East, Africa, South East Asia, the Americas, Australia and Europe. Open-source verification against the common- name profile space returns multiple plausible but unconfirmed matches. The dossier pauses in respectful silence until her own office supplies qualifications, bylines and masthead confirmation. For now the entry records: a byline in a diaspora newspaper and a community reading public.","Ms Zoya Khan is listed in the BFP Conclave 2026 register as Correspondent for the Indo Gulf Times — the Mumbai- based weekly tabloid serving NRIs and the Gulf-based Indian diaspora, with a readership spanning Asia, the Middle East, Africa, South East Asia, the Americas, Australia and Europe. For now the entry records: a byline in a diaspora newspaper and a community reading public"
usr_6ccfc70b38844dd2a716,Zoya Khan,honours,"Not publicly verifiable against this specific identifier. No Press Council of India awards, Red Ink Awards, or state-level journalism honours identified under this exact name-organisation pairing","No Press Council of India awards, Red Ink Awards, or state-level journalism honours identified under this exact name-organisation pairing"
usr_6ccfc70b38844dd2a716,Zoya Khan,qualifications,"Not publicly documented against this specific identity. Journalism background presumed given the Correspondent role. Specific university / media-school, Press Information Bureau (PIB) accreditation, editors-guild affiliations all pending BFP Bureau verification",Journalism background presumed given the Correspondent role
usr_d63ed8e7d9f6443aabc4,Zahra Bubere,designation,"Assistant Editor, Indo Gulf Times*** — the Mumbai-based weekly English-language NRI tabloid focused on Indo-Gulf relations and Dawoodi Bohra community affairs. Works on the same editorial team as Executive Editor Ahmar Bubere. Beat presumed to span community, cultural and NRI-related content; not independently confirmed","Assistant Editor, Indo Gulf Times*** — the Mumbai-based weekly English-language NRI tabloid focused on Indo-Gulf relations and Dawoodi Bohra community affairs. Works on the same editorial team as Executive Editor Ahmar Bubere"
usr_d63ed8e7d9f6443aabc4,Zahra Bubere,bio,"Ms Zahra Bubere serves as Assistant Editor of the Indo Gulf Times — the Mumbai-based weekly English-language NRI tabloid that crosses Indo-Gulf community affairs with reporting on Dawoodi Bohra cultural events such as the 9th Urs Mubarak Special Edition. She works on the same masthead as Executive Editor Mr Ahmar Bubere, presumed family. The Bubere surname is itself unmistakably Bohra — placing her in natural community-and-media adjacency to Dr Huzaifa Khorakiwala's own Dawoodi Bohra ecosystem. The dossier awaits her office to supply the particulars; the community link is already legible.","Ms Zahra Bubere serves as Assistant Editor of the Indo Gulf Times — the Mumbai-based weekly English-language NRI tabloid that crosses Indo-Gulf community affairs with reporting on Dawoodi Bohra cultural events such as the 9th Urs Mubarak Special Edition. She works on the same masthead as Executive Editor Mr Ahmar Bubere, presumed family. The Bubere surname is itself unmistakably Bohra — placing her in natural community-and-media adjacency to Dr Huzaifa Khorakiwala's own Dawoodi Bohra ecosystem. The dossier awaits her office to supply the particulars; the community link is already legible"
usr_d63ed8e7d9f6443aabc4,Zahra Bubere,honours,Not publicly verifiable against this specific identifier,
usr_d63ed8e7d9f6443aabc4,Zahra Bubere,qualifications,"Journalism and / or English-literature education presumed; specific institutions and degrees not publicly documented. No membership of Editors Guild of India, Mumbai Press Club or equivalent professional body independently verified",
usr_e8db84026fc64af68fe8,Pradeep Gandhi,designation,"Listed in the BFP register as ""President, UFME"" — expansion of the acronym ""UFME"" could not be independently corroborated against India's major SME/MSME apex bodies (India SME Forum, MSME Business Forum India, MSME & Startups Forum-Bharat are the main candidates but none is headed by him). His independently verifiable current positions include National President, The Prithvi Foundation; National Secretary, All India Ex-MPs Association; Chairman – Asar-Kari Yojna Aayog; State Head – Antyoday Abhiyan (Chhattisgarh, Jharkhand, Odisha); National Vice President – Akhil Bhartiya Vaisya Mahasammelan. Former Chairman, Zila Parishad Rajnandgaon; former MLA Chhattisgarh 2004; former Member of Parliament (14th Lok Sabha, Rajnandgaon constituency)","His independently verifiable current positions include National President, The Prithvi Foundation; National Secretary, All India Ex-MPs Association; Chairman – Asar-Kari Yojna Aayog; State Head – Antyoday Abhiyan (Chhattisgarh, Jharkhand, Odisha); National Vice President – Akhil Bhartiya Vaisya Mahasammelan. Former Chairman, Zila Parishad Rajnandgaon; former MLA Chhattisgarh 2004; former Member of Parliament (14th Lok Sabha, Rajnandgaon constituency)"
