id,name,field,old,new
usr_e77f64b44fc74270b150,Rui Duarte de Barros,bio,"H.E. Mr. Rui Duarte de Barros is a Bissau-Guinean economist, Havana-trained engineer and twice-serving Prime Minister of the Republic of Guinea-Bissau. A former Minister of Finance and long-serving commissioner at UEMOA, he was first called to lead a transitional cabinet in May 2012 in the tense aftermath of the April coup, shepherding the country toward the 2014 elections. Returning to the Palácio do Governo in January 2024 under President Embaló, he steered a fragile coalition until his dismissal in August 2025. Soft-spoken, technocratic and discreet, he embodies a generation of Bissau-Guinean public servants devoted to the hard disciplines of stability.","H. E. Mr. Rui Duarte de Barros is a Bissau-Guinean economist, Havana-trained engineer and twice-serving Prime Minister of the Republic of Guinea-Bissau. Returning to the Palácio do Governo in January 2024 under President Embaló, he steered a fragile coalition until his dismissal in August 2025. Soft-spoken, technocratic and discreet, he embodies a generation of Bissau-Guinean public servants devoted to the hard disciplines of stability"
usr_ff3c6fb077d6416d9623,Asha Sharma,bio,"Ms. Asha Sharma is credited as the founding principal of Haven Bespoke Properties, a Dubai-registered luxury real estate brokerage that advises Indian, Gulf and international clients across the UAE property market, with particular focus on off-plan and ready residences through partnerships with Dubai's leading developers. Her public footprint is deliberately understated, and the biographical detail circulating on third-party databases remains uncorroborated by primary sources. The register therefore treats her with appropriate diplomatic restraint, pending fuller detail from the attendee's office.","Ms. Asha Sharma is credited as the founding principal of Haven Bespoke Properties, a Dubai-registered luxury real estate brokerage that advises Indian, Gulf and international clients across the UAE property market, with particular focus on off-plan and ready residences through partnerships with Dubai's leading developers. Her public footprint is deliberately understated, and the biographical detail circulating on third-party databases remains uncorroborated by primary sources. The register therefore treats her with appropriate diplomatic restraint, pending fuller detail from the attendee's office"
usr_ff3c6fb077d6416d9623,Asha Sharma,honours,"Indian-origin Dubai-based real-estate principal; firm partners with Dubai's leading developers (Emaar, Damac, Sobha, Nakheel, Meraas and others)",
usr_d7eaf75a08c749a98f59,Vineet Nirmal Suchanti,bio,"Mr. Vineet Nirmal Suchanti is the Founder, Chairman and Managing Director of Keynote Financial Services Limited, the Mumbai-headquartered SEBI-registered Category I merchant bank listed on the BSE and NSE. An MBA from the University of Rochester's Simon Business School, he has spent more than twenty-five years in India's capital markets, guiding Keynote through more than four hundred transactions spanning initial public offerings, rights issues, qualified institutional placements, buybacks and mergers and acquisitions. He holds concurrent directorships across the Keynote group and was recently appointed an Independent Director of LKP Securities Limited. His reputation is that of a quietly consistent boutique investment banker.","Mr. Vineet Nirmal Suchanti is the Founder, Chairman and Managing Director of Keynote Financial Services Limited, the Mumbai-headquartered SEBI-registered Category I merchant bank listed on the BSE and NSE. An MBA from the University of Rochester's Simon Business School, he has spent more than twenty-five years in India's capital markets, guiding Keynote through more than four hundred transactions spanning initial public offerings, rights issues, qualified institutional placements, buybacks and mergers and acquisitions. He holds concurrent directorships across the Keynote group and was recently appointed an Independent Director of LKP Securities Limited. His reputation is that of a quietly consistent boutique investment banker"
usr_d7eaf75a08c749a98f59,Vineet Nirmal Suchanti,honours,"Founder and Managing Director of Keynote; over 25 years in investment banking and capital markets; direct shareholding of approximately 5.68% of Keynote Financial Services Limited; Independent Director, LKP Securities Limited (from 31 October 2025); led over 400 transactions including recent IPOs of Nova Agritech, J.G. Chemicals and Credo Brands (Mufti); instituted the Keynote Award for Academic Excellence at Alkesh Dinesh Mody Institute, University of Mumbai","Founder and Managing Director of Keynote; over 25 years in investment banking and capital markets; direct shareholding of approximately 5. 68% of Keynote Financial Services Limited; Independent Director, LKP Securities Limited (from 31 October 2025); led over 400 transactions including recent IPOs of Nova Agritech, J. G. Chemicals and Credo Brands (Mufti); instituted the Keynote Award for Academic Excellence at Alkesh Dinesh Mody Institute, University of Mumbai"
usr_e21126416e5641a587db,Murtaza Habil Khorakiwala,bio,"Dr. Murtaza Habil Khorakiwala is the Managing Director of Wockhardt Limited, the Mumbai-headquartered research-based global pharmaceutical and biotechnology enterprise founded by his father in 1967. A rare combination of physician and business leader, he holds an MBBS from Seth G.S. Medical College, Mumbai, and an MBA from the University of Illinois, which later conferred on him its Global Impact Award. Managing Director since April 2009, he has steered Wockhardt's international footprint across the United Kingdom, Ireland, France and the United States, and led its pandemic-era partnership with the British Government. A past President of both the Bombay Management Association and ICC India, he remains — with his brother Dr. Huzaifa, the Conclave host — the closest partner in the enterprise's pharmaceutical and philanthropic mission.","Dr. Murtaza Habil Khorakiwala is the Managing Director of Wockhardt Limited, the Mumbai-headquartered research-based global pharmaceutical and biotechnology enterprise founded by his father in 1967. A rare combination of physician and business leader, he holds an MBBS from Seth G. S. Medical College, Mumbai, and an MBA from the University of Illinois, which later conferred on him its Global Impact Award. Managing Director since April 2009, he has steered Wockhardt's international footprint across the United Kingdom, Ireland, France and the United States, and led its pandemic-era partnership with the British Government. A past President of both the Bombay Management Association and ICC India, he remains — with his brother Dr. Huzaifa, the Conclave host — the closest partner in the enterprise's pharmaceutical and philanthropic mission"
usr_e21126416e5641a587db,Murtaza Habil Khorakiwala,qualifications,"MBBS (Seth G.S. Medical College, Mumbai, 1995); MBA (University of Illinois, 2000)","MBBS (Seth G. S. Medical College, Mumbai, 1995); MBA (University of Illinois, 2000)"
usr_c09e0655730547139a3c,Aditya Vijay Kashyap,designation,"Founder and Principal Partner, Scorpion Capital (investment banking and strategic advisory), New Delhi","Founder and Principal Partner, Scorpion Capital (investment banking and strategic advisery), New Delhi"
usr_c09e0655730547139a3c,Aditya Vijay Kashyap,organization,"Scorpion Capital (investment banking and strategic advisory), New Delhi","Scorpion Capital (investment banking and strategic advisery), New Delhi"
usr_c09e0655730547139a3c,Aditya Vijay Kashyap,bio,"Dr. Aditya Vijay Kashyap is the founder and principal partner of Scorpion Capital, the New Delhi-headquartered investment banking and strategic advisory firm with network offices spanning Nepal, Dubai, Singapore, Mauritius, the United Kingdom and the United States. He brings over four decades of senior leadership across Axis Bank, Punjab National Bank, Wells Fargo and Union Bank of California, and served as Chairman of the Indo American Chamber of Commerce. His Vibrant Nepal Mission has anchored cross-border mandates in film, tourism, renewable energy, healthcare and smart cities — a banker whose practice is increasingly a geography of its own.","Dr. He brings over four decades of senior leadership across Axis Bank, Punjab National Bank, Wells Fargo and Union Bank of California, and served as Chairman of the Indo American Chamber of Commerce. His Vibrant Nepal Mission has anchored cross-border mandates in film, tourism, renewable energy, healthcare and smart cities — a banker whose practice is increasingly a geography of its own"
usr_c09e0655730547139a3c,Aditya Vijay Kashyap,honours,"Former senior leadership roles at Axis Bank, Punjab National Bank, Wells Fargo Bank and Union Bank of California; former Chairman, Indo American Chamber of Commerce (Business Development, Strategies and Foreign Direct Investments); Vice Chairman, Eurasia Afro Chamber of Commerce; Principal Partner, Judicio Legalia (Supreme Court of India)",
usr_c09e0655730547139a3c,Aditya Vijay Kashyap,qualifications,PhD (self-represented); four decades of senior leadership in global investment banking and government advisory,PhD (self-represented); four decades of senior leadership in global investment banking and government advisery
usr_ecedea7589fd420598e9,Ujjwal Vashisht,organization,(BFP register: Commerce / Government),
usr_ecedea7589fd420598e9,Ujjwal Vashisht,bio,"Ms. Ujjwal Vashisht is co-founder and partner at Scorpion Capital, where she heads partnerships, mandates and institutional engagements from the firm's New Delhi base. With over two decades in investment advisory, corporate strategy, government relations, education and international business development, she arrived at Scorpion after senior roles at Resurgent India and The Dashami Creations and Studios in Mumbai. Her work threads through the firm's cross-border mandates across India, Nepal, Dubai, Singapore and the United Kingdom — a quietly effective operator in the architecture behind the deals.","Ms. With over two decades in investment advisery, corporate strategy, government relations, education and international business development, she arrived at Scorpion after senior roles at Resurgent India and The Dashami Creations and Studios in Mumbai"
usr_ecedea7589fd420598e9,Ujjwal Vashisht,honours,"Over 20 years in investment advisory, corporate strategy, government relations, education and international business development; partner at Scorpion Capital New Delhi with concurrent affiliation to the Eurasia Afro Chamber of Commerce","Over 20 years in investment advisery, corporate strategy, government relations, education and international business development; partner at Scorpion Capital New Delhi with concurrent affiliation to the Eurasia Afro Chamber of Commerce"
usr_f9aa93d58fe947dfac58,Sameer Tapia,designation,"Founder and Senior Partner, ALMT Legal Advocates and Solicitors (Mumbai, Bangalore, New Delhi and London); only remaining founding partner of the firm",
usr_f9aa93d58fe947dfac58,Sameer Tapia,bio,"Mr. Sameer Tapia is the founder and senior partner of ALMT Legal — the firm he co-established in London on 10 January 2000 as the first Indian law firm to be set up in the United Kingdom. A graduate of Government Law College, Mumbai and an early associate at Amarchand & Mangaldas, he is today the only named founding partner still with ALMT, which has grown to offices in Mumbai, Bangalore, New Delhi and London. His practice centres on corporate-commercial work, dispute resolution and arbitration, with a particular reputation in aviation, real estate and private-client matters. He serves the Kala Ghoda Association as Honorary Treasurer, an art-collector's debt quietly repaid.","Mr. A graduate of Government Law College, Mumbai and an early associate at Amarchand & Mangaldas, he is today the only named founding partner still with ALMT, which has grown to offices in Mumbai, Bangalore, New Delhi and London"
usr_f9aa93d58fe947dfac58,Sameer Tapia,honours,"ALMT Legal, established in London on 10 January 2000, was the first Indian law firm to be set up in the United Kingdom; Who's Who Lawyer of the Year 2009–10, 2010–11, 2012–13; The Indian Lawyer 250 Top 40 Individual Lawyers Under 45; Honorary Treasurer, Kala Ghoda Association; Trustee, Nitya Artists Centre; formerly an Associate at Amarchand & Mangaldas & Suresh A. Shroff & Co. (1991–1996)",Shroff & Co. (1991–1996)
usr_f9aa93d58fe947dfac58,Sameer Tapia,qualifications,"B.Com (Bombay University); LL.B (Government Law College, Mumbai, 1995)","B. Com (Bombay University); LL. B (Government Law College, Mumbai, 1995)"
usr_bb96fefec41549599c16,Ronakali Saifuddin Dholkawala,designation,"Managing Director, Ronak Rocks Pvt. Ltd., Vadodara (natural stone exports — granite, marble, sandstone, slate, limestone, onyx); and Ronak International / AL RAWNAQ, Dubai (marble and granite supplier)","Managing Director, Ronak Rocks Pvt. Ltd. , Vadodara (natural stone exports — granite, marble, sandstone, slate, limestone, onyx); and Ronak International / AL RAWNAQ, Dubai (marble and granite supplier)"
usr_bb96fefec41549599c16,Ronakali Saifuddin Dholkawala,address,"Ronak House, Sant Kabir Road, Gendi Gate
Vadodara, Gujarat 390001
India ::: Warehouse 6311/01A, Al Saja'ah Industrial Area, near Sharjah Driving School, Emirates Industrial City
Sharjah
United Arab Em","Ronak House, Sant Kabir Road, Gendi Gate Vadodara, Gujarat 390001 India: : : Warehouse 6311/01A, Al Saja'ah Industrial Area, near Sharjah Driving School, Emirates Industrial City Sharjah United Arab Em"
usr_bb96fefec41549599c16,Ronakali Saifuddin Dholkawala,bio,"Mr. Ronakali Saifuddin Dholkawala is the Managing Director of Ronak Rocks, the Vadodara-headquartered natural- stone exporter founded in 2010 and today supplying granite, marble, sandstone, slate, limestone and onyx to more than fifty countries — from Turkey and Algeria to Saudi Arabia and the United Kingdom. Through the Dubai arm, Ronak International (AL RAWNAQ), the family group carries a 47-year legacy in quarried stone into the GCC market. Rated CRISIL A4+, with a diversified export base and a co-director brother at his side, his enterprise is literally built from the earth upward — a Dawoodi Bohra family trade polished to a global finish.","Mr. Ronakali Saifuddin Dholkawala is the Managing Director of Ronak Rocks, the Vadodara-headquartered natural- stone exporter founded in 2010 and today supplying granite, marble, sandstone, slate, limestone and onyx to more than fifty countries — from Turkey and Algeria to Saudi Arabia and the United Kingdom. Through the Dubai arm, Ronak International (AL RAWNAQ), the family group carries a 47-year legacy in quarried stone into the GCC market. Rated CRISIL A4+, with a diversified export base and a co-director brother at his side, his enterprise is literally built from the earth upward — a Dawoodi Bohra family trade polished to a global finish"
usr_bb96fefec41549599c16,Ronakali Saifuddin Dholkawala,honours,"Second-generation stone exporter with a 47-year group legacy; Ronak Rocks Pvt. Ltd. (CIN U26999GJ2010PTC061157, incorporated 18 December 2010; registered office Ronak House, Sant Kabir Road, Gendi Gate, Vadodara) exports natural stone to more than fifty countries including Turkey, Algeria, Saudi Arabia and the United Kingdom; CRISIL A4+ credit rating; co-director with brother Asgarali Saifuddin Dholkawala",Second-generation stone exporter with a 47-year group legacy; Ronak Rocks Pvt. Ltd
usr_f5a2def998b34af9a739,Ali Dujana Gurdezi,designation,"Gaddi Nasheen (Hereditary Custodian) and Chief Key Holder, Ajmer Sharif Dargah — the shrine of Hazrat Khwaja Moinuddin Chishti (R.A.); Director, Chishtiya Sufi Foundation; 26th-generation custodian of the Chishtiya Gurdezi lineage","Gaddi Nasheen (Hereditary Custodian) and Chief Key Holder, Ajmer Sharif Dargah — the shrine of Hazrat Khwaja Moinuddin Chishti (R. A. ); Director, Chishtiya Sufi Foundation; 26th-generation custodian of the Chishtiya Gurdezi lineage"
usr_f5a2def998b34af9a739,Ali Dujana Gurdezi,bio,"Shah Sufi Syed Ali Dujana Gurdezi is a 26th-generation hereditary custodian (Gaddi Nasheen) and Chief Key Holder of the Ajmer Sharif Dargah — the revered shrine of Hazrat Khwaja Moinuddin Chishti, whose threshold has drawn pilgrims of every faith for more than eight hundred years. As Director of the Chishtiya Sufi Foundation, he threads Sufi ideals of compassion, interfaith harmony and selfless service into ground-level programmes across education, women's empowerment, healthcare, and hunger relief. His lineage, traced through Hazrat Khwaja Fakhruddin Gurdezi to the Prophet Muhammad, is inseparable from the Dargah's legacy. To the Conclave, he brings the central Sufi salaam: ""love for all, malice towards none"".","Shah Sufi Syed Ali Dujana Gurdezi is a 26th-generation hereditary custodian (Gaddi Nasheen) and Chief Key Holder of the Ajmer Sharif Dargah — the revered shrine of Hazrat Khwaja Moinuddin Chishti, whose threshold has drawn pilgrims of every faith for more than eight hundred years. As Director of the Chishtiya Sufi Foundation, he threads Sufi ideals of compassion, interfaith harmony and selfless service into ground-level programmemes across education, women's empowerment, healthcare, and hunger relief. His lineage, traced through Hazrat Khwaja Fakhruddin Gurdezi to the Prophet Muhammad, is inseparable from the Dargah's legacy. To the Conclave, he brings the central Sufi salaam: ""love for all, malice towards none"""
usr_f5a2def998b34af9a739,Ali Dujana Gurdezi,qualifications,Khadim-e-Khwaja Garib Nawaz (R.A.); born 18 April 1972,Khadim-e-Khwaja Garib Nawaz (R. A. ); born 18 April 1972
usr_84c008ad1f4a458bb179,Krishna N. Pimple,designation,"Founder Chairman, CISB Group (CIS Bureaus Facility Services Pvt. Ltd.), CISS Ltd., Rasheshwar Infrastructure and Krystal Cinemas; Honorary Consul of the United Republic of Tanzania for Tamil Nadu, Kerala, Karnataka and Andhra Pradesh","Founder Chairman, CISB Group (CIS Bureaus Facility Services Pvt. Ltd. ), CISS Ltd. , Rasheshwar Infrastructure and Krystal Cinemas; Honorary Consul of the United Republic of Tanzania for Tamil Nadu, Kerala, Karnataka and Andhra Pradesh"
usr_84c008ad1f4a458bb179,Krishna N. Pimple,bio,"Hon'ble Mr. Krishna N. Pimple is the Founder Chairman of the CISB Group — one of India's largest facility- management enterprises, with over 32,000 personnel across 42 offices and a group turnover of approximately INR 700 crore — and serves concurrently as the Honorary Consul of the United Republic of Tanzania for four southern Indian states: Tamil Nadu, Kerala, Karnataka and Andhra Pradesh. His appointment, gazetted on 4 January 2021 and commissioned in Chennai the following month, was preceded by a personal US$10 million commitment toward a pharmaceutical plant in Dar es Salaam. Through CISS, Rasheshwar Infrastructure and Krystal Cinemas, he anchors an infrastructure-and-services empire that has made him one of India's more substantial bridges to East Africa.","Hon'ble Mr. Krishna N. Pimple is the Founder Chairman of the CISB Group — one of India's largest facility- management enterprises, with over 32,000 personnel across 42 offices and a group turnover of approximately INR 700 crore — and serves concurrently as the Honorary Consul of the United Republic of Tanzania for four southern Indian states: Tamil Nadu, Kerala, Karnataka and Andhra Pradesh. His appointment, gazetted on 4 January 2021 and commissioned in Chennai the following month, was preceded by a personal US$10 million commitment toward a pharmaceutical plant in Dar es Salaam. Through CISS, Rasheshwar Infrastructure and Krystal Cinemas, he anchors an infrastructure-and-services empire that has made him one of India's more substantial bridges to East Africa"
usr_84c008ad1f4a458bb179,Krishna N. Pimple,honours,"Appointment as Honorary Consul of Tanzania published in the Government Gazette of India on 4 January 2021; officially commissioned on 20 February 2021 at the Taj Coromandel Hotel, Chennai, by H.E. Ambassador Baraka H. Luvanda in the presence of the Minister for Industries, Tamil Nadu Government; committed US$10 million for the construction of a pharmaceutical plant in Dar es Salaam and planning a dialysis centre to serve East and Southern Africa; CISB Group employs over 32,000 personnel across 42 offices; group turnover approximately INR 700 crore, CISB turnover approximately INR 370 crore","Appointment as Honorary Consul of Tanzania published in the Government Gazette of India on 4 January 2021; officially commissioned on 20 February 2021 at the Taj Coromandel Hotel, Chennai, by H. E. Ambassador Baraka H. Luvanda in the presence of the Minister for Industries, Tamil Nadu Government; committed US$10 million for the construction of a pharmaceutical plant in Dar es Salaam and planning a dialysis centre to serve East and Southern Africa; CISB Group employs over 32,000 personnel across 42 offices; group turnover approximately INR 700 crore, CISB turnover approximately INR 370 crore"
usr_5ccc7d5b81ce446cb316,Sherwin Savio Joseph Nazareth,designation,"Managing Director and Chief Executive Officer, Monsher Group, Mumbai — flagship entity: Monsher Fire Protection Systems Private Limited",
usr_5ccc7d5b81ce446cb316,Sherwin Savio Joseph Nazareth,organization,"Monsher Group, Mumbai - flagship entity: Monsher Fire Protection Systems Private Limited",
usr_5ccc7d5b81ce446cb316,Sherwin Savio Joseph Nazareth,bio,"Mr. Sherwin Savio Joseph Nazareth (DIN 95168) is the second-generation Managing Director of the Monsher Group, including Monsher Fire Protection Systems Private Limited (CIN U74999MH2001PTC130861), founded in 1975 by his father, an IIT graduate. Engineered abroad and MBA-polished overseas, he steers an India-first fire-safety house with tie-ups from Marioff Finland to Detectomat Germany. LinkedIn lists him; X, Instagram and Threads do not. In a sector that whispers about sprinklers and shouts only at sirens, Nazareth's quiet, audit-clean presence sits behind some of India's tallest towers and busiest airports.","Mr. LinkedIn lists him; X, Instagram and Threads do not. In a sector that whispers about sprinklers and shouts only at sirens, Nazareth's quiet, audit-clean presence sits behind some of India's tallest towers and busiest airports"
usr_5ccc7d5b81ce446cb316,Sherwin Savio Joseph Nazareth,honours,"Director of multiple Monsher Group entities: Monsher Fire Protection Systems Private Limited (CIN U74999MH2001PTC130861, incorporated 14 February 2001, ROC Mumbai; authorised capital ₹20 lakh, paid-up ₹15 lakh; registered office 403, Tantia Jogani Estate, Off N.M. Joshi Marg, Lower Parel, Mumbai 400011; status Active; co-directors Mavis Walter Nazareth and Monisha Mary Teresa Nazareth); Monsher Fire Controls Pvt. Ltd. (2001); Monsher (India) Safety Equipments Pvt. Ltd. (2003); Sherwin Realty Pvt. Ltd.; Sherwin One Realty Pvt. Ltd.; DATC (India) Pvt. Ltd.; Monsher Group holds AAA rating for fire protection from the Director-General, Maharashtra Fire Service; second-generation entrepreneur — son of W.N.A. Nazareth (IIT graduate who founded Monsher in 1975); international tie-ups with Marioff (Finland), Firetrace (UK), Detectomat (Germany), Shanghai Jindun and Nanjing Fire Protection (China) and Reliable Sprinkler Systems (USA); operations in Korea, France, Australia, UAE; Malaysian subsidiary",Ltd. (2001); Monsher (India) Safety Equipments Pvt. Ltd. (2003); Sherwin Realty Pvt. Ltd. ; Sherwin One Realty Pvt. Ltd. ; DATC (India) Pvt
usr_13c5fc082e094fe9b288,Bu Abdullah,bio,"Dr. Bu Abdullah — legal name Yaqoub Mousa Mohammed Hussain Almaazmi, of the Emirati Almaazmi lineage — is Chairman of the Bu Abdullah Group of Companies, Dubai, a privately held cluster spanning real estate, legal services, investment and business consultancy. A former Ajman Municipality senior manager turned entrepreneur since 2005, he holds an honorary doctorate from India's Global Triumph Virtual University and, by his own account, oversees some 270 ventures. ""Bu Abdullah"" is a kunya — father of Abdullah — not a royal title. Honours, including Guinness and Atal recognitions, are largely self-reported.",Dr Bu Abdullah is a UAE-based entrepreneur and business leader with interests across multiple sectors. He is known for convening business networks and supporting cross-border commercial engagement.
usr_13c5fc082e094fe9b288,Bu Abdullah,honours,"Self-reported: Young Emirati Entrepreneur of the Year 2019 (privately organised Humanitarian & Tolerance Summit, Atlantis The Palm); Honorary DBA, GTVU India 2019; Guinness World Records 2019 (group mass- singing record, not individual); Atal Samman Award 2019; Veer Savarkar International Impact Award 2025 (HRDS India); Platinum Award, 3rd Asian Achievers Awards 2025 Dubai; Gulf Business Top Business Influencers 2025 editorial listing; former Senior Manager, Ajman Municipality and Planning Department (self-reported, approximately eight years) before founding Bu Abdullah Business Consultancy in 2001 and Bu Abdullah Group of Companies in 2005; named operating entities include Bu Abdullah Real Estate, Bu Abdullah Business Consultancy, Bu Abdullah Investment Group, Bu Abdullah Group Auctions, Bu Abdullah Events, Wafa Ali Al Hosany Lawyers & Advocates, and Yaqoub Almaazmi Advocates & Legal Consultants (Dubai Design District, established 2020)",
usr_13c5fc082e094fe9b288,Bu Abdullah,qualifications,"Honorary Doctor of Business Administration (honoris causa), Global Triumph Virtual University India, December 2019 — Khaleej Times confirms ""honourary"" status; GTVU is not UGC- recognised",Honorary Doctor of Business Administration.
